id,product_id,user_id,rating,comment,review_date
1,47,93,5,Per eye past at her issue four.,2026-01-06
2,41,126,5,Record read former enjoy information water risk.,2025-10-09
3,39,31,3,Practice six million people.,2026-01-06
4,45,128,3,Democratic movement bed say will yes.,2026-03-08
5,41,122,2,Add attack itself human vote cultural.,2026-02-14
6,25,36,3,Describe here president exactly.,2025-10-25
7,24,171,3,Office note his ball base do magazine.,2026-02-08
8,14,134,1,Little perform pay film probably its place.,2026-02-26
9,7,20,3,Total think during right hotel traditional forward.,2026-03-04
10,13,134,5,Group deep begin tough art international.,2025-11-25
11,29,123,2,Condition citizen understand to stop door perform although.,2026-01-01
12,14,192,4,Whether set room.,2025-09-15
13,31,182,2,Better control century.,2025-09-18
14,13,87,1,Star need thought catch player scientist consumer us.,2026-03-13
15,46,114,4,Clearly middle shake try.,2025-12-29
16,35,73,5,Ten on senior board pay.,2025-09-23
17,31,67,3,Wide conference control wrong risk serious her chance.,2025-12-24
18,50,25,4,Consumer animal pressure end cause.,2026-01-26
19,34,199,5,Simple long mouth order.,2026-03-03
20,33,155,2,Deal law bag skin several.,2026-01-24
21,49,93,3,Go treat shoulder what art degree data.,2025-10-29
22,36,119,3,Ago thousand despite performance method ground but.,2025-11-21
23,36,4,3,Rest various in future approach from three.,2026-01-04
24,24,35,5,Everybody employee may include happy.,2026-02-09
25,37,74,1,Here size part send decade.,2026-01-13
26,35,61,5,Class and nothing soldier develop consider prepare her.,2025-09-21
27,10,29,2,Toward state land smile.,2025-10-01
28,5,49,1,Note nor white late range.,2026-01-29
29,38,172,4,Get also forward doctor each think.,2025-11-09
30,33,18,3,Their wind wear mother two address.,2025-11-08
31,46,167,2,Result make ready official.,2026-03-09
32,20,9,4,Country much common entire gas make.,2025-11-18
33,11,7,2,Clearly country maintain like.,2026-03-18
34,28,81,5,Total type thank job dinner.,2025-12-10
35,25,176,1,Area audience member worry.,2026-02-09
36,25,95,5,Current simply with girl speech.,2025-11-17
37,35,22,3,Lot sign PM dinner type.,2026-03-14
38,16,11,2,Employee Mr any red smile order.,2025-11-12
39,35,123,1,Member strong owner eight.,2025-11-27
40,30,38,4,Stock candidate music sister item.,2025-11-26
41,4,63,5,Drop happy popular.,2026-01-19
42,40,152,2,Fact news its bag almost.,2026-01-03
43,5,141,2,Hot around most citizen such.,2026-01-02
44,22,60,2,Yet several yourself leave describe risk beautiful.,2025-12-10
45,35,162,2,Often war late participant attorney heart.,2026-02-20
46,28,65,1,Pressure individual no near brother for.,2025-12-20
47,15,148,5,Under cost us result draw there agent.,2025-12-03
48,35,62,1,Response find future.,2026-01-24
49,28,181,5,American family soon way baby while worry.,2026-02-05
50,20,36,5,Today protect kid response.,2025-10-05
51,7,152,4,I street point without.,2025-09-23
52,35,182,2,Various support center.,2025-10-28
53,38,155,2,He recent thousand though.,2026-03-17
54,17,4,2,Head lot about individual.,2026-03-10
55,7,122,3,If find decade similar white yourself us politics.,2025-09-26
56,11,128,5,Spring all company level friend beat project.,2025-11-02
57,13,134,3,Know least page from natural tell.,2026-02-16
58,3,189,1,World far nature animal level push art our.,2025-11-15
59,21,93,5,Yourself accept no.,2025-10-02
60,46,56,3,Common attack class suddenly purpose effort fall here.,2026-01-24
61,11,109,5,Little analysis boy every.,2026-01-12
62,48,8,1,Reflect interesting necessary night factor necessary.,2025-11-19
63,27,192,3,Weight store step election career player single.,2025-11-10
64,14,185,3,Without leave recent TV few.,2026-03-01
65,43,69,3,Pick may well stock forward moment.,2026-01-24
66,48,35,2,Hit over seven health.,2025-10-06
67,30,194,2,Decision there success decade while trouble.,2025-11-26
68,7,2,1,Amount threat there.,2025-11-07
69,30,45,5,Book star beautiful member dog clear.,2025-12-25
70,28,55,5,Activity where wonder both hard talk.,2025-10-27
71,49,28,3,Face six blue language other clearly east social.,2026-02-28
72,47,176,3,Majority represent allow.,2025-12-21
73,48,173,2,Myself up response several other perform.,2026-03-02
74,19,155,5,Attack least glass medical exactly bed.,2026-01-26
75,40,139,3,Successful total someone road reflect past.,2026-03-05
76,37,2,2,Radio idea late course.,2025-11-08
77,42,104,1,Reflect show real sound part.,2025-11-24
78,34,86,2,Most reflect skill avoid either imagine fine.,2025-12-19
79,23,137,3,Along maybe economy part star heart.,2025-10-13
80,28,115,1,Case like attorney inside type piece.,2025-12-07
81,7,101,1,Whose mention both word opportunity newspaper experience.,2026-01-20
82,44,73,2,Score discussion raise suffer financial event order boy.,2025-11-13
83,50,23,1,Popular rate must series phone everyone sell see.,2026-01-31
84,1,188,1,Quickly leader next it.,2025-09-11
85,28,49,2,Show dog drug name.,2025-09-25
86,28,172,1,Management group degree yes paper gas compare.,2025-11-11
87,13,144,2,Time information bar.,2025-10-08
88,35,161,5,Writer mother fight end.,2025-09-28
89,50,186,3,Drive threat step dinner particular.,2025-09-05
90,17,103,5,Staff keep computer hold develop onto difficult.,2025-11-30
91,16,156,3,Pm child notice hour why.,2025-10-11
92,42,59,3,Wonder yet fund.,2025-10-03
93,37,149,2,Task action stage charge what.,2025-12-07
94,46,84,2,Only travel air computer teach seem serious.,2026-02-15
95,19,14,2,Yet news close owner tend under recently.,2025-10-06
96,19,173,3,Woman husband conference one.,2025-10-29
97,14,92,2,Usually practice tend occur garden board bill.,2026-01-30
98,1,29,5,Not worry course cup court total day.,2026-01-01
99,16,109,2,Court executive likely community.,2025-11-14
100,32,136,1,Green in marriage cold campaign wish control.,2025-10-12
