"id","product_id","user_id","rating","comment","review_date"
"1","22","189","4","Sell least do green above floor feeling.","2026-01-07"
"2","8","178","4","Accept kind consumer wide line land until look.","2025-11-15"
"3","3","130","5","One country rock attack yet.","2025-11-19"
"4","19","85","5","Kind cultural choice once also west member.","2026-01-06"
"5","25","170","1","Radio community simple experience.","2026-03-05"
"6","27","148","1","Sit order memory.","2026-03-12"
"7","21","58","2","Religious have enough stuff later green fear.","2025-10-12"
"8","10","25","4","Drive require gas Democrat have spring various.","2025-09-18"
"9","9","138","1","Everything training most record.","2025-12-20"
"10","6","51","4","But great fear from.","2026-03-24"
"11","19","193","3","Color east enjoy quality training soon agreement.","2025-10-27"
"12","3","139","3","Never mission religious too painting.","2025-10-09"
"13","5","49","5","American threat similar.","2026-01-08"
"14","3","160","4","However game job decade student cell.","2025-11-29"
"15","13","150","5","Home crime support term might sport through.","2026-03-18"
"16","9","65","2","Lose even head.","2025-09-16"
"17","8","188","2","Friend green president resource present early.","2026-03-15"
"18","4","192","1","Themselves like it area own first.","2026-01-10"
"19","1","31","3","Treatment win century spend item trip.","2025-11-11"
"20","2","154","1","Almost board book management.","2025-09-18"
"21","12","105","1","Main other them brother director never scientist.","2026-01-07"
"22","14","69","3","Huge able commercial.","2025-10-19"
"23","26","131","2","People certain adult customer purpose.","2026-01-21"
"24","17","188","2","Camera source personal wide officer land such.","2025-12-02"
"25","21","191","1","Wish event institution prove tree discussion.","2025-12-27"
"26","23","97","4","Responsibility cultural until door receive there.","2026-02-15"
"27","21","109","5","House thing short alone win discussion coach.","2025-10-29"
"28","17","113","1","Will church fine never challenge.","2025-12-27"
"29","22","196","2","Above change and left.","2026-01-05"
"30","23","110","4","Travel candidate summer try hotel in.","2026-02-20"
"31","4","118","4","Finish buy risk visit hold name.","2025-10-27"
"32","14","56","1","Ten base continue try unit specific establish.","2026-02-24"
"33","30","48","1","Agreement face learn example knowledge new.","2026-01-31"
"34","26","7","2","Treatment week article sense hot.","2025-09-23"
"35","14","20","2","Long agreement visit walk expect.","2026-01-10"
"36","13","128","3","Recognize hundred radio meeting family enough who.","2026-03-28"
"37","13","134","3","War hear step.","2026-01-09"
"38","9","115","3","Be marriage surface end practice news.","2026-02-17"
"39","5","149","4","Must economy chair alone marriage dog.","2025-12-25"
"40","13","154","4","Key action by make power walk cold.","2026-02-04"
"41","24","179","2","Need cover technology international end walk character.","2025-12-08"
"42","26","80","4","We city top.","2025-11-17"
"43","18","59","2","Tonight determine couple other.","2026-01-14"
"44","5","43","5","Teacher beyond finally feeling.","2025-12-12"
"45","16","151","2","Week speak finish over create but.","2025-11-12"
"46","19","40","4","Price know new within work join.","2025-10-21"
"47","21","180","5","Guy old control beyond small glass.","2026-03-20"
"48","4","89","2","Computer stand cover loss a return ten his.","2025-11-08"
"49","2","169","5","Relate political room determine if unit price.","2025-09-24"
"50","28","87","5","Play message student event young.","2025-12-10"
"51","17","60","3","Situation follow learn where big difference.","2025-11-30"
"52","16","139","2","Appear choose bit sport many vote.","2025-12-23"
"53","24","96","2","Teach ability require anyone outside.","2026-03-01"
"54","25","126","1","Mention teach energy PM quickly day night participant.","2025-11-01"
"55","8","49","3","Hand guy crime management myself year.","2026-03-04"
"56","2","55","1","Care source marriage probably make.","2025-11-03"
"57","1","142","2","Along career positive behind away left.","2025-10-06"
"58","16","105","4","Set better why than.","2025-09-18"
"59","23","35","2","Economic up blue dark should technology get.","2025-11-16"
"60","29","134","2","Dinner clear air real edge.","2026-03-31"
"61","13","115","2","Bed ability my whatever training here.","2025-09-20"
"62","27","17","4","Sister create everything building too although.","2026-02-18"
"63","2","57","3","Success road plan.","2026-03-10"
"64","26","150","3","While president learn shake.","2025-12-06"
"65","7","59","4","Prepare station dream first not material.","2025-11-17"
"66","26","146","5","Tax account name scientist over.","2026-01-18"
"67","13","73","3","Sit room important left.","2025-12-02"
"68","5","46","2","Hear alone focus stop project.","2025-10-15"
"69","27","148","4","Site outside car behind.","2025-09-27"
"70","6","158","5","Tough whether old along five.","2026-01-09"
"71","16","18","1","Call pretty father board full these.","2026-03-17"
"72","20","7","1","That management whom reality take.","2025-11-12"
"73","16","81","4","My ball various between history forward.","2026-02-07"
"74","26","69","3","Beat with need record.","2025-11-07"
"75","17","105","4","Gun forward campaign theory than fight evidence.","2026-03-04"
"76","17","169","3","Left mind member detail.","2026-02-25"
"77","17","27","5","Vote officer card send.","2025-12-06"
"78","17","150","4","Break purpose sister before when born chance student.","2025-12-13"
"79","8","121","1","Food whom value article.","2026-01-03"
"80","24","101","1","Foreign case likely public.","2025-12-01"
"81","16","74","1","Heart I two beyond maybe.","2025-09-30"
"82","27","23","3","Goal despite center per leg evidence.","2026-03-17"
"83","17","176","1","President level mean employee option system manage.","2026-01-31"
"84","6","148","1","Tonight beyond might include agent.","2025-11-06"
"85","21","172","1","Compare despite season structure half unit.","2026-02-05"
"86","1","133","2","Nation animal since movie prepare brother.","2025-12-30"
"87","12","192","3","Help social music sometimes perform.","2025-10-31"
"88","9","107","2","Pass necessary before eight beautiful exist.","2025-09-25"
"89","6","21","3","Dark source onto gas discover soon financial contain.","2026-02-06"
"90","28","8","4","Suddenly woman ahead personal fine.","2025-12-08"
"91","8","82","3","Finish better term up.","2026-02-07"
"92","16","83","4","Together recent form current understand tell.","2025-09-14"
"93","18","12","1","Health significant from anyone bit speech.","2026-03-20"
"94","22","86","4","Game feeling yeah story.","2025-09-16"
"95","19","130","5","Focus dark deep maybe city.","2026-01-19"
"96","5","140","1","Future early pick accept want local detail.","2026-03-24"
"97","18","142","4","Board north society last new lose.","2026-03-06"
"98","3","91","2","Indeed staff old century rather school various.","2026-03-03"
"99","14","44","4","Exist himself city throw stuff.","2026-01-05"
"100","5","179","3","Girl director number.","2025-12-04"
"101","25","49","5","Through oil green read develop ever.","2026-02-12"
"102","14","81","5","Recent rest sure join thus.","2025-09-24"
"103","7","4","5","Include performance despite woman begin entire.","2025-12-04"
"104","7","126","4","Court leg possible wide relationship certain.","2025-10-15"
"105","14","117","5","Buy people now tree modern let sit.","2025-10-13"
"106","6","64","2","Building part research TV tree area.","2025-09-20"
"107","7","164","5","Look start defense certain.","2025-12-05"
"108","5","131","5","Suggest us east system.","2025-12-04"
"109","24","63","1","Spend toward time much thing.","2025-09-28"
"110","24","187","1","Fine will soldier executive discussion rule.","2025-12-11"
"111","1","161","4","Thought miss happen father.","2025-10-02"
"112","7","91","5","Against represent his letter.","2025-09-27"
"113","27","94","1","Budget discuss provide feel pressure the.","2025-10-08"
"114","7","72","2","Truth left too north prepare degree affect tonight.","2025-12-11"
"115","29","8","3","However case painting economy.","2025-09-23"
"116","23","78","1","Medical most consumer off kitchen.","2026-01-24"
"117","6","69","3","Per them anything court blood team.","2026-03-22"
"118","21","93","4","Maybe give edge information which decision.","2026-02-12"
"119","5","155","3","Smile scene church spring.","2025-12-17"
"120","5","27","3","Probably world worry lay may employee do.","2026-02-24"
"121","21","125","4","Debate own case beautiful.","2025-09-30"
"122","14","83","2","Lot effort foot public.","2025-11-23"
"123","25","78","3","Clear television college hundred well ready.","2026-02-16"
"124","4","89","3","Our husband professor across method.","2026-01-15"
"125","12","162","5","Value mind yard hard material.","2026-03-05"
"126","10","183","5","Hope north money something physical bag car public.","2025-10-19"
"127","14","82","2","Find surface discussion challenge song.","2026-01-18"
"128","5","37","1","Vote nation listen lawyer.","2025-10-28"
"129","28","198","4","College first finish employee program which.","2025-10-11"
"130","15","159","3","Reveal individual car peace west military my.","2025-11-29"
"131","3","108","1","Employee partner party technology bed.","2025-10-05"
"132","24","146","1","Be line plant both.","2025-09-12"
"133","9","107","1","Position tree turn over let.","2026-01-28"
"134","5","148","3","Parent organization per very.","2025-12-01"
"135","14","142","3","Keep street final grow red follow skill.","2025-12-11"
"136","8","157","2","Successful stage on once.","2025-12-10"
"137","16","29","1","Research move step share game see.","2026-03-20"
"138","30","28","3","A myself describe article nice education onto bag.","2026-01-29"
"139","19","133","3","Risk west western star fine grow.","2025-11-28"
"140","14","107","1","Long town program different.","2026-02-17"
"141","14","131","3","Me real short need.","2026-03-31"
"142","22","1","4","Argue firm between him woman.","2025-09-20"
"143","24","26","5","Data two political drug fill help account.","2025-12-03"
"144","11","35","2","Task such room participant surface.","2025-12-04"
"145","16","102","4","Style head great son.","2025-09-15"
"146","13","185","3","Know catch any poor half relate short.","2025-12-13"
"147","29","114","5","Which company there kid.","2025-09-21"
"148","11","76","2","Page blood Congress either.","2026-01-10"
"149","10","133","5","Season beyond federal six address truth someone.","2026-02-26"
"150","24","118","5","Instead why ten region American must.","2026-02-27"
"151","10","124","1","Meeting sing choice rate his.","2026-02-10"
"152","15","71","3","Day position according support lot phone I.","2025-11-28"
"153","21","94","5","Nature modern affect economic cover show hotel.","2025-09-23"
"154","25","151","5","Player including piece better she free each.","2025-11-05"
"155","4","22","1","Two son this forget approach attack.","2026-01-19"
"156","29","71","5","Wide represent my.","2025-10-26"
"157","25","76","1","Mother career decision capital back focus school grow.","2026-02-09"
"158","18","179","1","Country space several source civil blood.","2025-10-01"
"159","5","111","1","Statement task improve store growth raise.","2025-12-01"
"160","4","130","4","Task talk amount maybe feel fact talk bed.","2026-02-28"
"161","27","164","3","Tell our although central job million former.","2025-12-16"
"162","7","164","4","Listen life discussion focus fact general.","2026-03-13"
"163","28","118","3","Will what several require.","2025-10-20"
"164","10","3","3","On lay field shake exactly.","2026-01-10"
"165","24","8","3","Put scientist tonight bring mean life.","2025-12-01"
"166","22","51","2","Note trial necessary tax alone.","2025-11-04"
"167","12","171","5","Care cup because wish.","2025-12-22"
"168","24","96","2","And agent language face father.","2025-11-16"
"169","24","152","5","Modern responsibility catch political gas.","2026-03-17"
"170","8","73","4","Establish manager tax.","2025-10-06"
"171","3","46","1","Machine deal according specific rate minute western production.","2025-10-03"
"172","7","32","2","Actually first cover think.","2026-03-28"
"173","29","161","2","Energy write treat among institution everybody TV.","2026-03-31"
"174","7","127","5","Give hear itself sort close.","2025-12-01"
"175","25","145","2","School assume possible short.","2025-11-19"
"176","28","87","5","Better as member job cup skill.","2025-09-15"
"177","4","80","3","Toward hair pick among.","2026-01-29"
"178","18","153","5","They foot member ask company method arm.","2026-02-20"
"179","23","170","5","Amount medical talk special image.","2025-12-29"
"180","12","172","5","Past research turn enter.","2025-10-09"
"181","15","155","5","Response thing poor pass air line.","2025-10-25"
"182","2","199","3","Spend way week create work.","2025-10-03"
"183","26","139","4","Design political quickly station.","2025-12-11"
"184","27","193","3","Record natural responsibility husband political police woman.","2026-01-21"
"185","11","26","1","Language check allow I huge.","2025-11-07"
"186","13","150","1","Realize along family six bill after clearly.","2026-03-06"
"187","29","61","1","Generation quality yet long fight both look.","2026-03-30"
"188","24","81","5","Difficult head local ever protect billion.","2025-12-19"
"189","10","4","1","Rather ground establish maybe stop clear.","2026-01-02"
"190","18","146","2","Accept peace debate fast watch method join.","2026-01-09"
"191","1","99","3","Make care they price woman ball prepare.","2025-11-24"
"192","22","17","5","Choice peace food.","2025-11-16"
"193","3","141","3","Response yes step raise bit.","2026-01-20"
"194","22","33","5","Political evening thus success hard.","2026-03-31"
"195","22","35","5","Middle apply high.","2026-02-09"
"196","26","127","4","Democratic see give style modern.","2025-10-31"
"197","8","101","4","Difficult surface mind next base.","2026-02-14"
"198","18","21","3","Age put in seek point amount among fund.","2025-09-13"
"199","2","8","2","Then lawyer attorney too science.","2025-10-01"
"200","19","75","2","Newspaper home treat manager.","2026-03-12"
